{
  "schema_version": "1.0.0",
  "bundle_id": "bundle_carla_00000123_req_1",
  "request_id": "req-1",
  "source": "carla",
  "frame_id": "carla_00000123",
  "simulation_frame": 123,
  "timestamp_s": 6.15,
  "synchronization": {
    "status": "EXACT",
    "reference_frame": 123,
    "reference_timestamp_s": 6.15,
    "tolerance_ms": 50.0,
    "max_skew_ms": 0.0,
    "required_modalities": [
      "instruction",
      "front_rgb",
      "left_rgb",
      "right_rgb",
      "rear_rgb",
      "lidar",
      "world_state"
    ],
    "missing_modalities": []
  },
  "instruction": {
    "source": "asr",
    "text": "看到前方行人后减速避让，然后向左变道",
    "language": "zh-CN",
    "confidence": 0.98,
    "timestamp_s": 6.1
  },
  "cameras": [
    {
      "sensor_name": "front_rgb",
      "frame": 123,
      "timestamp_s": 6.15,
      "image_path": "sensors/front_rgb/00000123.png",
      "image_size": {
        "width": 800,
        "height": 600
      },
      "intrinsic_matrix": [
        400.0,
        0.0,
        400.0,
        0.0,
        400.0,
        300.0,
        0.0,
        0.0,
        1.0
      ],
      "sensor_to_ego": [
        1.0,
        0.0,
        0.0,
        0.0,
        0.0,
        1.0,
        0.0,
        0.0,
        0.0,
        0.0,
        1.0,
        0.0,
        0.0,
        0.0,
        0.0,
        1.0
      ]
    },
    {
      "sensor_name": "left_rgb",
      "frame": 123,
      "timestamp_s": 6.15,
      "image_path": "sensors/left_rgb/00000123.png",
      "image_size": {
        "width": 800,
        "height": 600
      },
      "intrinsic_matrix": [
        400.0,
        0.0,
        400.0,
        0.0,
        400.0,
        300.0,
        0.0,
        0.0,
        1.0
      ],
      "sensor_to_ego": [
        1.0,
        0.0,
        0.0,
        0.0,
        0.0,
        1.0,
        0.0,
        0.0,
        0.0,
        0.0,
        1.0,
        0.0,
        0.0,
        0.0,
        0.0,
        1.0
      ]
    },
    {
      "sensor_name": "right_rgb",
      "frame": 123,
      "timestamp_s": 6.15,
      "image_path": "sensors/right_rgb/00000123.png",
      "image_size": {
        "width": 800,
        "height": 600
      },
      "intrinsic_matrix": [
        400.0,
        0.0,
        400.0,
        0.0,
        400.0,
        300.0,
        0.0,
        0.0,
        1.0
      ],
      "sensor_to_ego": [
        1.0,
        0.0,
        0.0,
        0.0,
        0.0,
        1.0,
        0.0,
        0.0,
        0.0,
        0.0,
        1.0,
        0.0,
        0.0,
        0.0,
        0.0,
        1.0
      ]
    },
    {
      "sensor_name": "rear_rgb",
      "frame": 123,
      "timestamp_s": 6.15,
      "image_path": "sensors/rear_rgb/00000123.png",
      "image_size": {
        "width": 800,
        "height": 600
      },
      "intrinsic_matrix": [
        400.0,
        0.0,
        400.0,
        0.0,
        400.0,
        300.0,
        0.0,
        0.0,
        1.0
      ],
      "sensor_to_ego": [
        1.0,
        0.0,
        0.0,
        0.0,
        0.0,
        1.0,
        0.0,
        0.0,
        0.0,
        0.0,
        1.0,
        0.0,
        0.0,
        0.0,
        0.0,
        1.0
      ]
    }
  ],
  "lidar": {
    "sensor_name": "roof_lidar",
    "frame": 123,
    "timestamp_s": 6.15,
    "point_cloud_path": "sensors/roof_lidar/00000123.ply",
    "point_count": 64000,
    "coordinate_frame": "sensor",
    "sensor_to_ego": [
      1.0,
      0.0,
      0.0,
      0.0,
      0.0,
      1.0,
      0.0,
      0.0,
      0.0,
      0.0,
      1.0,
      0.0,
      0.0,
      0.0,
      0.0,
      1.0
    ]
  },
  "world_state": {
    "frame_id": "carla_00000123",
    "simulation_frame": 123,
    "timestamp_s": 6.15,
    "path": "world_states/carla_00000123.json"
  },
  "provenance": {
    "capture_module": "carla_multimodal_sensor_manager",
    "metric_source": "carla_actor_api"
  }
}
